{
  "$schema": "https://json-schema.org/draft/2020-12/schema",
  "title": "FreeBuddy runtime provider declaration (submissions/providers/<id>.json)",
  "description": "One provider per file. Merging a PR that changes a declaration file is the review gate: .github/workflows/sync-providers.yml turns these files into upserts against the D1 providers table, which backs GET /api/providers. Adding a provider = add the file; taking one offline = set status to \"disabled\" plus offlineReason/offlineAt; restoring it = set status back to \"approved\".",
  "type": "object",
  "required": ["id", "name", "protocol", "baseUrl", "models", "status"],
  "additionalProperties": false,
  "properties": {
    "$schema": {
      "type": "string",
      "description": "可选，仅用于编辑器补全，例如 \"../providers.schema.json\"。同步脚本会忽略它。"
    },
    "id": {
      "type": "string",
      "pattern": "^[a-z0-9][a-z0-9_-]{0,63}$",
      "description": "小写 slug，必须与文件名一致（submissions/providers/<id>.json），也是 D1 的主键与页面上判断「已导入」的依据。"
    },
    "name": {
      "type": "string",
      "minLength": 1,
      "maxLength": 80,
      "description": "服务商展示名称。"
    },
    "icon": {
      "type": "string",
      "maxLength": 200,
      "description": "LobeHub 图标名（如 zhipu-color）或 https:// 图标地址；非 https 的地址一律拒绝。"
    },
    "region": {
      "enum": ["cn", "global"],
      "description": "cn = 国内直连，global = 海外。"
    },
    "homepage": {
      "type": "string",
      "format": "uri",
      "pattern": "^https://",
      "description": "官方网站，必须是 https://，且不能带用户名密码或指向 localhost。"
    },
    "consoleUrl": {
      "type": "string",
      "format": "uri",
      "pattern": "^https://",
      "description": "申请 API Key / 控制台直达链接，必须是 https://。"
    },
    "freeTierSummary": {
      "type": "object",
      "minProperties": 1,
      "maxProperties": 10,
      "additionalProperties": { "type": "string", "minLength": 1, "maxLength": 400 },
      "description": "免费政策简述，键为语言代码（zh-CN / en）。"
    },
    "claimGuide": {
      "type": "object",
      "minProperties": 1,
      "maxProperties": 10,
      "additionalProperties": {
        "type": "array",
        "minItems": 1,
        "maxItems": 10,
        "items": { "type": "string", "minLength": 1, "maxLength": 200 }
      },
      "description": "领取免费额度的步骤，键为语言代码（zh-CN / en），值为按顺序排列的步骤数组。"
    },
    "protocol": {
      "enum": ["openai-chat", "openai-responses", "anthropic", "deepseek"],
      "description": "决定 FreeBuddy 用哪个基座 CLI 承载。"
    },
    "protocols": {
      "type": "array",
      "minItems": 1,
      "items": { "enum": ["openai-chat", "openai-responses", "anthropic", "deepseek"] },
      "description": "可选，一个服务商支持多个协议时列出全部。"
    },
    "baseUrl": {
      "type": "string",
      "format": "uri",
      "pattern": "^https://",
      "description": "兼容协议的 API 端点，必须是 https://，末尾不带斜杠。"
    },
    "envKey": {
      "type": "string",
      "pattern": "^[A-Z][A-Z0-9_]{1,63}$",
      "description": "环境变量名，通常为 OPENAI_API_KEY。"
    },
    "models": {
      "type": "array",
      "minItems": 1,
      "maxItems": 50,
      "description": "模型列表，models[0] 为导入后的默认模型，id 不能重复。",
      "items": {
        "type": "object",
        "required": ["id"],
        "additionalProperties": false,
        "properties": {
          "id": { "type": "string", "minLength": 1, "maxLength": 200 },
          "name": { "type": "string", "minLength": 1, "maxLength": 80 },
          "contextWindow": { "type": "integer", "minimum": 1 },
          "supportsVision": { "type": "boolean" }
        }
      }
    },
    "contextWindow": {
      "type": "integer",
      "minimum": 1,
      "description": "服务商级别的默认上下文长度（可选）。"
    },
    "verifiedAt": {
      "type": "string",
      "pattern": "^\\d{4}-\\d{2}-\\d{2}$",
      "description": "最近一次人工核验日期，必须是真实存在的 YYYY-MM-DD。"
    },
    "status": {
      "enum": ["pending", "approved", "disabled", "rejected"],
      "description": "pending = 已声明待审核；approved = 已审核，GET /api/providers 会返回；disabled = 显式下线，接口不再返回但记录保留；rejected = 审核不通过。只有 approved 会被接口返回。"
    },
    "submittedBy": {
      "type": "string",
      "pattern": "^[A-Za-z0-9](?:[A-Za-z0-9-]{0,38})$",
      "description": "可选，投稿人 GitHub 登录名，写入 D1 的 submitted_by 用于追溯。"
    },
    "offlineReason": {
      "type": "string",
      "minLength": 1,
      "maxLength": 400,
      "description": "status = \"disabled\" 时必填：下线原因（额度结束、接口变更、长期不可用等）。"
    },
    "offlineAt": {
      "type": "string",
      "pattern": "^\\d{4}-\\d{2}-\\d{2}$",
      "description": "status = \"disabled\" 时必填：下线日期（真实存在的 YYYY-MM-DD）。"
    }
  },
  "allOf": [
    {
      "if": {
        "properties": { "status": { "const": "disabled" } },
        "required": ["status"]
      },
      "then": {
        "required": ["offlineReason", "offlineAt"]
      },
      "else": {
        "properties": {
          "offlineReason": false,
          "offlineAt": false
        }
      }
    }
  ]
}
