{"$schema":"../providers.schema.json","baseUrl":"https://integrate.api.nvidia.com/v1","consoleUrl":"https://build.nvidia.com","envKey":"NVIDIA_API_KEY","freeTierSummary":{"en":"Free hosted inference endpoints for 100+ models on build.nvidia.com, OpenAI-compatible. No credit card; phone/email verification required. The main limit is about 40 requests per minute. Model IDs may change; check the official catalog.","zh-CN":"build.nvidia.com 提供上百个模型的免费托管推理入口，OpenAI 兼容，免信用卡，需手机号/邮箱验证。主要限制约 40 请求/分钟。模型 ID 可能调整，以官网 catalog 为准。"},"homepage":"https://build.nvidia.com","id":"nvidia-nim","models":[{"id":"deepseek-ai/deepseek-v4-flash-0731","name":"DeepSeek V4 Flash (free)"},{"id":"nvidia/nemotron-nano-3-30b-a3b","name":"Nemotron Nano 3 30B (free)"},{"id":"meta/muse-glimmer-30b","name":"Muse Glimmer 30B (free)"},{"id":"meta/llama-3.3-70b-instruct","name":"Llama 3.3 70B Instruct (free)"}],"name":"NVIDIA NIM","protocol":"openai-chat","region":"global","status":"approved","submittedBy":"static-catalog-import","verifiedAt":"2026-09-24"}