{
  "$schema": "../providers.schema.json",
  "id": "sensenova",
  "name": "商汤日日新 SenseNova",
  "icon": "sensenova-color",
  "region": "cn",
  "homepage": "https://platform.sensenova.cn",
  "consoleUrl": "https://platform.sensenova.cn/console/keys",
  "freeTierSummary": {
    "zh-CN": "商汤 Token Plan 开放公测，实名认证后赠送高频免费额度，每 5 小时重置 1500 次 SenseNova Flash-Lite 调用，兼容 OpenAI 协议。",
    "en": "SenseNova Token Plan offers free tiered quotas resetting every 5 hours with up to 1,500 free calls for SenseNova Flash-Lite."
  },
  "protocol": "openai-chat",
  "baseUrl": "https://token.sensenova.cn/v1",
  "envKey": "SENSENOVA_API_KEY",
  "models": [
    {
      "id": "sensenova-6.8-flash-lite",
      "name": "SenseNova 6.8 Flash-Lite",
      "contextWindow": 131072,
      "supportsVision": true
    },
    {
      "id": "sensenova-6.7-flash-lite",
      "name": "SenseNova 6.7 Flash-Lite",
      "contextWindow": 131072,
      "supportsVision": true
    },
    {
      "id": "deepseek-v4-flash",
      "name": "DeepSeek V4 Flash",
      "contextWindow": 65536
    }
  ],
  "verifiedAt": "2026-09-10",
  "status": "approved",
  "submittedBy": "static-catalog-import"
}
