{
  "$schema": "../providers.schema.json",
  "id": "b-ai",
  "name": "B.AI",
  "region": "global",
  "homepage": "https://b.ai",
  "consoleUrl": "https://b.ai",
  "freeTierSummary": {
    "zh-CN": "当前提供 GLM 5.3 Flash、Qwen3.8 Flash、Hy3、Mimo2.5 等多款大模型限时免费（0 Credits）调用，注册另赠送体验额度，兼容 OpenAI 接口协议。",
    "en": "Currently offering limited-time free access (0 Credits) to GLM 5.3 Flash, Qwen3.8 Flash, Hy3, and Mimo2.5; new accounts also get trial credits."
  },
  "protocol": "openai-chat",
  "baseUrl": "https://api.b.ai/v1",
  "envKey": "BAI_API_KEY",
  "models": [
    {
      "id": "glm-5.3-flash",
      "name": "GLM 5.3 Flash (限免)",
      "contextWindow": 1048576,
      "supportsVision": true
    },
    {
      "id": "qwen3.8-flash",
      "name": "Qwen3.8 Flash (限免)",
      "contextWindow": 1048576,
      "supportsVision": true
    },
    {
      "id": "hy3",
      "name": "Hy3 (限免)",
      "contextWindow": 256000
    },
    {
      "id": "mimo-2.5",
      "name": "Mimo2.5 (限免)",
      "contextWindow": 256000,
      "supportsVision": true
    },
    {
      "id": "deepseek-chat",
      "name": "DeepSeek-V3",
      "contextWindow": 64000
    },
    {
      "id": "deepseek-reasoner",
      "name": "DeepSeek-R1 (推理思考)",
      "contextWindow": 64000
    }
  ],
  "verifiedAt": "2026-09-24",
  "status": "disabled",
  "submittedBy": "static-catalog-import",
  "offlineReason": "2026-09-16 17:00（SGT）起，Qwen3.8-Flash、Hy3、MiMo-V2.5 等限免转为折扣计费，全站模型均已标价；2026-09-18 第三方核验确认无免费模型剩余，仅剩邀请注册赠金。予以下线。",
  "offlineAt": "2026-09-24"
}
