{
  "$schema": "../providers.schema.json",
  "id": "deepseek",
  "name": "DeepSeek 深度求索",
  "icon": "deepseek-color",
  "region": "cn",
  "homepage": "https://deepseek.com",
  "consoleUrl": "https://platform.deepseek.com/api_keys",
  "freeTierSummary": {
    "zh-CN": "API 按量计费、价格极低；新用户或有赠送体验额度（以控制台为准）。当前模型为 DeepSeek-V4.1-Flash（deepseek-flash）与 DeepSeek-V4-Pro（deepseek-v4-pro），上下文 1M，支持深度思考模式。",
    "en": "Pay-as-you-go API with very low prices; new accounts may receive trial credits (see console). Current models: DeepSeek-V4.1-Flash (deepseek-flash) and DeepSeek-V4-Pro (deepseek-v4-pro), 1M context, thinking mode supported."
  },
  "protocol": "deepseek",
  "protocols": [
    "deepseek",
    "openai-chat"
  ],
  "baseUrl": "https://api.deepseek.com",
  "envKey": "DEEPSEEK_API_KEY",
  "models": [
    {
      "id": "deepseek-flash",
      "name": "DeepSeek-V4.1-Flash",
      "contextWindow": 1048576
    },
    {
      "id": "deepseek-v4-pro",
      "name": "DeepSeek-V4-Pro",
      "contextWindow": 1048576
    }
  ],
  "verifiedAt": "2026-09-27",
  "status": "approved",
  "submittedBy": "static-catalog-import"
}
